,gname,score,keyword,gregion,gcountry,summary,date,nkill,nwound,property,country_txt,region_txt
3,Muslim extremists,411.0,approximately 264,South Asia,Afghanistan,"An explosive device consisting of a pressure cooker, nails, BBs, and a detonator fashioned from the remote control of a toy car went off near the finish line of the Boston Marathon on Boylston Street in the Back Bay neighborhood of Boston, Massachusetts, United States. This was the second of two similar bombs that detonated approximately 12 seconds and 100 yards apart. The detonation of second device, which was located near Forum Restaurant, killed spectators Martin Richard and Lingzi Lu. Approximately 264 others were wounded in the two attacks. The alleged assailants of the blasts were later identified as Tamerlan and Dzhokhar Tsarnaev, brothers who immigrated to the United States from Russia in 2002 and 2003. On April 19, 2013, as part of an attempt to flee the Boston area, the assailants were involved in a shootout with police that resulted in the death of Tamerlan Tsarnaev. Dzhokhar Tsarnaev was arrested later that evening after he was discovered hiding in a boat that was parked in a Watertown, Massachusetts resident's backyard. Tsarnaev had written a claim of responsibility on the side of the boat. On July 10, 2013, Dzhokhar Tsarnaev pleaded not guilty to 30 federal counts related to the attack, including one for the use of a weapon of mass destruction. Tsarnaev was ultimately found guilty on all counts, and sentenced to the death penalty on June 24, 2015.",2013/4/15,2.0,132.0,1,United States,North America
2,Muslim extremists,406.0,approximately 264,South Asia,Afghanistan,"An explosive device consisting of a pressure cooker, nails, BBs, and a detonator fashioned from the remote control of a toy car detonated near the finish line of the Boston Marathon on Boylston Street in the Back Bay neighborhood of Boston, Massachusetts, United States. This was the first of two similar bombs that detonated approximately 12 seconds and 100 yards apart. The detonation of first device, which was located near Marathon Sports, killed spectator Krystle Campbell. Approximately 264 others were wounded in the two attacks. The alleged assailants of the blasts were later identified as Tamerlan and Dzhokhar Tsarnaev, brothers who immigrated to the United States from Russia in 2002 and 2003. On April 19, 2013, as part of an attempt to flee the Boston area, the assailants were involved in a shootout with police that resulted in the death of Tamerlan Tsarnaev. Dzhokhar Tsarnaev was arrested later that evening after he was discovered hiding in a boat that was parked in a Watertown, Massachusetts resident's backyard. Tsarnaev had written a claim of responsibility on the side of the boat. On July 10, 2013, Dzhokhar Tsarnaev pleaded not guilty to 30 federal counts related to the attack, including one for the use of a weapon of mass destruction. Tsarnaev was ultimately found guilty on all counts, and sentenced to the death penalty on June 24, 2015.",2013/4/15,1.0,132.0,1,United States,North America
5,Muslim extremists,63.0,boston marathon,South Asia,Afghanistan,"Police thwarted a potential bomb attack when they engaged in a firefight with the alleged assailants of the Boston Marathon bombings, Tamerlan and Dzhokhar Tsarnaev, in Watertown, Massachusetts, United States. Shortly after hijacking a civilian vehicle, the suspects were confronted by police, leading to a firefight that resulted in the death of Tamerlan Tsarnaev. Dzhokhar Tsarnaev and 16 police officers were injured in the exchange. One of the injured officers,  Dennis Simmonds, succumbed to his injuries on April 10, 2014. During the encounter, the suspects hurled explosives at the officers. It was later revealed that the Tsarnaev brothers were plotting to use the explosives to carry out an attack in an unconfirmed location. Dzhokhar Tsarnaev was arrested later that evening after he was discovered hiding in a boat that was parked in a Watertown, Massachusetts, resident's backyard. Tsarnaev had written a claim of responsibility on the side of the boat. On July 10, 2013, Dzhokhar Tsarnaev pleaded not guilty to 30 federal counts related to the Boston attacks, including one for the use of a weapon of mass destruction.",2013/4/19,2.0,16.0,1,United States,North America
1,Anti-Police extremists,8.0,personal frustrations,North America,United States,"An assailant opened fire on two Riverside police officers in Corona, California, United States. One police officer died and the other officer was wounded in the asault. The perpetrator, Christopher Dorner, posted a lengthy statement online detailing his grievances, including both his personal frustrations regarding his dismissal from the Los Angeles Police Department (LAPD) as well as what he viewed as excessive use of force and racism in policing. This attack took place in the context of an extensive manhunt for Dorner, who carried out an initial attack on February 3 against targets he selected in retaliation for the decision to fire him. Following the manhunt, police located and surrounded Dorner in a remote cabin where he had died of a self-inflicted gunshot wound.",2013/2/7,1.0,1.0,0,United States,North America
6,Anti-Muslim extremists,5.0,great manchester,North America,United States,"Assailants vandalized the Islamic Society of Great Manchester Mosque and attempted to set it on fire in Manchester, New Hampshire, United States. There were no reported casualties in the attack. Two assailants, identifed as anti-Muslim extremists, claimed responsibility for the incident.",2013/7/25,0.0,0.0,1,United States,North America
0,Animal Liberation Front (ALF),2.0,animal liberation,Western Europe,United Kingdom,"Assailants threw an incendiary device at a Royal Canadian Mounted Police (RCMP) vehicle in Vancouver, Canada. There were no reported casualties in the attack. The Animal Liberation Front (ALF) claimed responsibility for the incident and stated that the victim was targeted for owning a fur store.",2013/1/5,0.0,0.0,0,Canada,North America
4,Muslim extremists,5.0,dzhokhar tsarnaev,South Asia,Afghanistan,"A Massachusetts Institute of Technology (MIT) police officer, Sean Collier, was shot and killed by gunmen on the MIT campus in Cambridge, Massachusetts, United States. The suspected assailants of the attack were later identified as Tamerlan and Dzhokhar Tsarnaev, who are believed to also be responsible for the double bomb attack near the finish line of the Boston Marathon that took place on April 15, 2013. Shortly after the killing of Collier, the suspects were involved in a shootout with police as they attempted to flee the Boston area. Tamerlan Tsarnaev was killed in the firefight. Dzhokhar Tsarnaev was arrested later that evening after he was discovered hiding in a boat that was parked in a Watertown, Massachusetts resident's backyard. Tsarnaev had written a claim of responsibility on the side of the boat. On July 10, 2013, Dzhokhar Tsarnaev pleaded not guilty to 30 federal counts related to the killing of Collier and the marathon attacks.",2013/4/18,1.0,0.0,0,United States,North America
