,gname,score,keyword,gregion,gcountry,summary,date,nkill,nwound,property
1440,Taliban,2088.0,security force,South Asia,Afghanistan,"Assailants raided Kunduz city, Afghanistan. The assailants attacked civilians and security force members, stormed the prison and released more than 500 inmates, set fire to an unknown number of buildings, and gained control of the city. At least four people and 20 assailants were killed and 50 people were injured during the preliminary raid. Clashes continued until security forces regained control of Kunduz on October 1, 2015. After four days of fighting, 40 people and 200 assailants were reported dead and 296 people were injured. This was one of three coordinated attacks in Kunduz on the same day. The Taliban claimed responsibility for the incident.",2015/9/28,240.0,296.0,-9
1177,Taliban,1285.0,group claimed,South Asia,Afghanistan,"A suicide bomber detonated an explosives-laden truck at National Directorate of Security (NDS) office building in Kabul city, Kabul province, Afghanistan. In addition to the suicide bomber, 15 people were killed and 400 others were injured in the blast. No group claimed responsibility for the incident; however, sources attributed the attack to the Taliban, which denied responsibility.",2015/8/7,16.0,400.0,1
1513,Taliban,653.0,taliban claimed,South Asia,Afghanistan,"Assailants attacked security forces on the Kabul-Kandahar highway in the Nawrak area, near Ghazni city, Ghazni province, Afghanistan. At least 10 civilians and 90 assailants were killed and 51 assailants were injured in the ensuing clashes. The Taliban claimed responsibility for the incident.",2015/10/12,100.0,51.0,0
1845,Tehrik-i-Taliban Pakistan (TTP),293.0,least 26,South Asia,Pakistan,"A suicide bomber detonated at a National Database and Registration Authority (NADRA) office in Mardan, Khyber Pakhtunkhwa province, Pakistan. In addition to the bomber, at least 26 people were killed and more than 50 others were injured in the blast. Jamaat-ul-Ahrar, a faction of Tehrik-i-Taliban Pakistan (TTP), claimed responsibility for the attack, although another TTP representative denied the group's involvement.",2015/12/29,27.0,51.0,1
1398,Tehrik-i-Taliban Pakistan (TTP),276.0,suicide bombers,South Asia,Pakistan,"Suicide bombers armed with rocket launchers, grenades, and firearms attacked the Pakistan Air Force base in Badaber, Khyber Pakhtunkhwa province, Pakistan. At least 42 people, including 26 soldiers, 13 assailants, and three civilians, were killed and 22 others, including 10 soldiers, were injured in the ensuing clash. The Tehrik-i-Taliban Pakistan (TTP) claimed responsibility and stated that the attack was carried out in retaliation for recent military operations.",2015/9/18,42.0,22.0,-9
1237,Tehrik-i-Taliban Pakistan (TTP),166.0,shadi khan,South Asia,Pakistan,"Two suicide bombers detonated inside the office of Shuja Khanzada in Shadi Khan village, Punjab province, Pakistan. In addition to the two bombers, at least 20 people, including Khanzada, the Punjab Prime Minister, were killed and 17 others were injured in the blasts. Tehrik-i-Taliban Pakistan (TTP) and Lashkar-e-Jhangvi separately claimed responsibility and stated that the attack was carried out in retaliation for the death of a leader of Lashkar-e-Jhangvi. Additionally, Lashkar-e-Islam (Pakistan) claimed responsibility and stated that the attack was carried out in revenge for military operations against the group.",2015/8/16,22.0,17.0,1
36,Pro Hartal Activists,155.0,udayan express,South Asia,India,"Assailants removed railway tracks in Kulaura area, Moulvibazar district, Sylhet division, Bangladesh. The act caused the derailment of an Udayan Express train; 50 passengers were injured as a result of the attack. No group claimed responsibility; however, sources attributed the incident to pro-hartal activists.",2015/1/8,0.0,50.0,1
1418,Muslim extremists,145.0,least 14,South Asia,Afghanistan,"Assailants fired mortars that landed and detonated in Al-Midan neighborhood, Aleppo city, Aleppo governorate, Syria. At least 14 people were killed and 25 others were injured in the attack. No group claimed responsibility; however, sources attributed the incident to Muslim fundamentalists.",2015/9/20,14.0,25.0,-9
1379,Muslim extremists,136.0,least 20,South Asia,Afghanistan,"Assailants fired rockets that landed and detonated in Al-Hamdaniya neighborhood, Aleppo city, Aleppo governorate, Syria. This was one of three projectile attacks in different neighborhoods of Aleppo on the same day. At least 20 people were killed and 95 others were injured across all three incidents. No group claimed responsibility; however, sources attributed the attacks to Muslim fundamentalists.",2015/9/15,7.0,32.0,1
1378,Muslim extremists,133.0,least 20,South Asia,Afghanistan,"Assailants fired rockets that landed and detonated in Salaheddine neighborhood, Aleppo city, Aleppo governorate, Syria. This was one of three projectile attacks in different neighborhoods of Aleppo on the same day. At least 20 people were killed and 95 others were injured across all three incidents. No group claimed responsibility; however, sources attributed the attacks to Muslim fundamentalists.",2015/9/15,7.0,31.0,1
1746,Maoists,40.0,special task,South Asia,India,"Assailants opened fire on Special Task Force (STF) officers in Kistaram area, Chhattisgarh state, India. Five assailants were killed and five officers were injured in the ensuing clash. No group claimed responsibility for the incident; however, sources attributed the attack to Maoists.",2015/12/8,5.0,5.0,0
1273,Maoists,38.0,group claimed,South Asia,India,"Assailants detonated a landmine and opened fire against Border Security Force (BSF) personnel in Chitrkonda area, Odisha state, India. Four people, including three BSF members and a civilian, were killed and six other BSF members were injured in the attack. No group claimed responsibility for the incident; however, sources attributed the attack to Maoists.",2015/8/26,4.0,6.0,-9
362,Maoists,37.0,group claimed,South Asia,India,"Assailants attacked a mica mine and abducted 11 workers in Giridih district, Jharkhand state, India. All of the hostages were released shortly after the kidnapping. The manager, identified as Shyamsunder Rawut, was killed and nine other workers were injured in the attack. No group claimed responsibility; however, sources attributed the incident to Maoists.",2015/3/13,1.0,9.0,1
191,Pro Hartal Activists,32.0,least nine,South Asia,India,"Assailants removed fishplates from train tracks in Mirsharai area, Chittagong division, Bangladesh. A Mymensingh Express train derailed as a result, injuring at least nine people. No group claimed responsibility; however, sources attributed the incident to pro-hartal activists.",2015/2/2,0.0,9.0,1
161,Pro Hartal Activists,24.0,two similar,South Asia,India,"Assailants threw six explosive devices outside of gate No. 2 at New Market area, Dhaka city, Dhaka division, Bangladesh. Eight people were injured in the attack. This was one of two similar attacks that occurred at the New Market area on the same date. No group claimed responsibility; however, sources suspected the involvement of pro-hartal activists.",2015/1/29,0.0,8.0,-9
