pub_date,keyword_name,keyword_value,word_count,score,headline_main
 2016-12-06T10:59:13+0000,glocations,NewYorkCity,1175,7.698007e-08,New  York  Today:  Treasures  in  Our  Waters 
 2016-11-23T10:57:09+0000,glocations,NewYorkCity,936,2.5645297e-08,New  York  Today:  What  We’re  Grateful  for  This  Thanksgiving 
 2016-11-14T11:01:36+0000,glocations,NewYorkCity,1023,1.1624869e-08,New  York  Today:  Behold,  the  Supermoon 
 2016-08-06T09:01:05+0000,glocations,PuertoRico,4902,2.6006378e-13,A  Surreal  Life  on  the  Precipice  in  Puerto  Rico 
 2016-06-10T01:02:21+0000,glocations,Peru,657,6.952942e-16,Pedro  Kuczynski  Declares  Victory  Over  Keiko  Fujimori  for  Peru  Presidency 
 2016-06-06T00:00:00Z,glocations,Peru,730,4.185711e-16,Pedro  Kuczynski  Holds  Thin  Lead  Over  Keiko  Fujimori  in  Peru  Presidential  Election 
 2016-02-02T00:00:00Z,glocations,Peru,973,6.4529414e-24,Peru’s  Possible  Prison  Presidency 
 2015-12-02T00:00:00Z,glocations,Peru,378,4.75782e-28,American  Convicted  in  Peru  Plot  Plans  to  Return  to  U.S. 
 2015-05-15T00:00:00Z,glocations,Macedonia,1424,1.4e-45,Tiny  Macedonia  Confronts  a  Supersize  Scandal 
 2015-04-24T00:00:00Z,glocations,Turkey,1121,0.0,Hidden  Armenians  of  Turkey  Seek  to  Reclaim  Their  Erased  Identities 
 2015-04-07T11:00:25+0000,glocations,WickenFen(Cambridgeshire,England),1333,0.0,The  Living  Beauty  of  Wicken  Fen 
 2015-01-12T21:17:01Z,glocations,AntarcticRegions,1285,0.0,Too  Soon  Gone:  Alberto  Behar,  Who  Used  Robots  and  Rubber  Ducks  to  Probe  Icy  Secrets 
 2014-11-26T15:22:03+0000,glocations,Turkey,7158,0.0,The  Mine  Disaster  That  Shook  Turkey 
 2014-08-05T01:49:48+0000,glocations,GazaStrip,6584,0.0,Eight  Days  in  Gaza:  A  Wartime  Diary 
 2014-06-30T15:22:37Z,glocations,Germany,2785,0.0,Germany  vs.  Algeria:  World  Cup  2014  Live  Blog 
 2014-04-03T08:05:54Z,glocations,KualaLumpur(Malaysia),1398,0.0,Chasing  the  Money  for  Families  of  Passengers  on  Missing  Flight 
 2014-03-21T11:30:08Z,glocations,Hydra(Greece),2756,0.0,Beyond  the  Sea 
 2014-02-19T19:57:49+0000,glocations,InteroceanicHighway(Brazil-Peru),5978,0.0,Traveling  From  Ocean  to  Ocean  Across  South  America 
 2014-02-12T10:54:42+0000,glocations,Georgia,1127,0.0,Czar  Vladimir's  Illusions 
 2014-02-07T07:00:46Z,glocations,Russia,5617,0.0,Highlights:  The  Winter  Olympics  Opening  Ceremony 
 2013-12-13T00:00:00Z,glocations,Harlem(Manhattan,NY),6439,0.0,Amid  Repressed  Hopes,  Reasons  to  Dream 
 2013-12-12T00:00:00Z,glocations,Brooklyn(NYC),4513,0.0,Finding  Safety  and  Strength  in  the  Bonds  of  Her  Siblings 
 2013-10-14T00:00:00Z,glocations,BayofBengal,926,0.0,Quick  Evacuation  Efforts  Help  India  Minimize  Deaths  From  Cyclone 
 2013-09-23T16:49:57Z,glocations,Canada,1118,0.0,Go  East  Old  Man:  In  the  Wet  of  the  Night 
 2013-09-22T00:00:00Z,glocations,Reykjavik(Iceland),1745,0.0,36  Hours  in  Reykjavik 
 2013-06-08T00:00:00Z,glocations,Peru,152,0.0,Peru:  Ex-President  Is  Denied  a  Pardon 
 2013-04-22T00:00:00Z,glocations,Atlanta(Ga),1130,0.0,In  Atlanta,  Two  Churches  Lie  in  New  Stadium’s  Path 
 2013-03-10T00:00:00Z,glocations,Myanmar,1312,0.0,In  Public  Eye,  Shining  Star  of  Myanmar  Loses  Luster 
 2012-10-09T12:49:19Z,glocations,KualaLumpur(Malaysia),850,0.0,In  the  Dark  Cave,  Fearsome  Living  Fossils 
 2012-08-21T15:09:10Z,glocations,Namibia,863,0.0,Winding  Down  the  Elephant  Season 
 2012-07-08T00:00:00Z,glocations,Argentina,1193,0.0,Once  Just  a  Stopover  for  Drug  Traffickers,  Argentina  Has  Now  Become  a  Destination 
 2012-06-27T00:00:00Z,glocations,Mongolia,1331,0.0,In  Mongolia,  a  New,  Penned-In  Wealth 
 2012-05-16T00:00:00Z,glocations,Peru,970,0.0,Dam  Project  Threatens  a  Way  of  Life  in  Peru 
 2012-05-11T00:00:00Z,glocations,Peru,105,0.0,Peru:  Cabinet  Officials  Resign 
 2012-04-10T00:00:00Z,glocations,Peru,97,0.0,Peru:  Gunmen  Abduct  Workers  at  Gas  Pipeline 
 2012-02-10T16:53:22+0000,glocations,AranIslands(Ireland),5863,0.0,My  Debt  to  Ireland 
 2012-01-11T14:30:04Z,glocations,NewHampshire,589,0.0,Ron  Paul's  Victory  Speech 
 2011-10-13T01:30:10+0000,glocations,SierraLeone,799,0.0,One  Girl’s  Courage 
 2011-08-21T00:00:00Z,glocations,GreatBritain,2219,0.0,In  Father’s  Memory,  Fighting  to  Stay  in  Britain 
 2011-07-19T14:30:00Z,glocations,Syria,1063,0.0,U.S.  Falls  Short  of  Moral  High  Ground  on  Syria 
 2011-03-14T00:00:00Z,glocations,Egypt,942,0.0,Milestone  Referendum  in  Egypt  Just  Days  Away 
 2011-01-16T00:00:00Z,glocations,India,3089,0.0,India,  Through  a  Birder’s  Eyes 
 2010-08-15T00:00:00Z,glocations,China,1216,0.0,Tensions  Over  Chinese  Mining  Venture  in  Peru 
 2010-07-01T00:00:00Z,glocations,LatinAmerica,1114,0.0,Economies  in  Latin  America  Race  Ahead 
 2010-06-23T00:00:00Z,glocations,Peru,133,0.0,Peru:  Report  Shows  Gains  in  Coca 
 2010-06-14T00:00:00Z,glocations,Peru,1072,0.0,Coca  Production  Makes  a  Comeback  in  Peru 
 2010-06-13T21:07:02Z,glocations,Peru,30,0.0,Peru's  Coca  Conflict 
 2010-04-02T00:00:00Z,glocations,Sudan,927,0.0,Opposition  Boycotts  in  Sudan  Elections 
 2010-01-15T00:00:00Z,glocations,India,1013,0.0,A  Test  Ahead  for  India's  Defiant  Optimism 
 2009-09-04T12:53:00Z,glocations,Peru,103,0.0,Peru:  Shining  Path  Shoots  Down  Copter 
 2009-05-10T00:00:00Z,glocations,NewtownCreek(NYC),1056,0.0,The  Ironic  Nature  Walk 
 2009-04-19T00:00:00Z,glocations,Idaho,5625,0.0,The  End  Is  Near!  (Yay!) 
 2009-04-14T00:00:00Z,glocations,Peru,361,0.0,Fujimori’s  Instructive  Fall 
 2009-04-12T00:00:00Z,glocations,Peru,126,0.0,13  Peruvian  Troops  Killed  in  Ambushes 
 2009-03-18T00:00:00Z,glocations,Peru,1386,0.0,Cocaine  Trade  Helps  Rebels  Reignite  War  in  Peru 
 2009-03-17T13:01:49Z,glocations,Peru,31,0.0,A  Hunt  for  Rebels  in  the  Jungles  of  Peru 
 2008-07-03T00:00:00Z,glocations,Colombia,1688,0.0,Colombia  Plucks  Hostages  From  Rebels’  Grasp 
 2008-07-02T00:00:00Z,glocations,Colombia,1980,0.0,Hostages  Freed  in  Colombia  Return  Home 
 2008-06-09T00:00:00Z,glocations,India,1718,0.0,Inside  Gate,  India’s  Good  Life;  Outside,  the  Servants’  Slums 
 2007-12-12T00:00:00Z,glocations,Peru,434,0.0,Peru’s  Ex-President  Gets  6  Years  for  Illicit  Search 
 2007-12-10T00:00:00Z,glocations,Peru,889,0.0,Ex-President  Stands  Trial  in  Edgy  Peru 
 2007-11-03T00:00:00Z,glocations,Peru,101,0.0,Peru:  Police  Chief  Dies  in  Assault 
 2007-09-23T00:00:00Z,glocations,Peru,610,0.0,Chile  Returns  Fujimori  to  Peru  to  Face  Charges 
 2007-08-15T00:00:00Z,glocations,Peru,94,0.0,Peru:  21  Suspects  Captured  in  Guerrilla  Drug  Trafficking 
 2007-04-05T00:00:00Z,glocations,Peru,782,0.0,Rights  Groups  Hail  Arrests  of  3  by  U.S.  in  War  Crimes 
 2007-04-01T00:00:00Z,glocations,NewJersey,868,0.0,Ex-Basketball  Star  Helps  Rebuild  His  Hometown 
 2007-01-11T00:00:00Z,glocations,Peru,180,0.0,Ruling  on  Shining  Path  Rebels  Angers  Peru 
 2006-10-29T00:00:00Z,glocations,Peru,1038,0.0,Past  War  and  Cruelty,  Peru’s  Writers  Bloom 
 2006-10-15T00:00:00Z,glocations,NewJersey,288,0.0,The  Great  Food  at  My  Child’s  School;  The  Many  Benefits  of  Light  Rail  (2  Letters) 
 2006-09-02T00:00:00Z,glocations,Peru,136,0.0,Peru:  Runner-Up  Charged 
 2006-08-17T00:00:00Z,glocations,Peru,190,0.0,Peruvian  Prosecutors  Pursue  Ex-Candidate 
 2006-06-26T00:00:00Z,glocations,NewYorkCity,2130,0.0,Renewed  Push  for  the  Artistic  ABC's  in  N.Y. 
 2006-06-05T00:00:00Z,glocations,Peru,732,0.0,Ex-President  Wins  in  Peru  in  Stunning  Comeback 
 2006-06-03T00:00:00Z,glocations,Peru,1311,0.0,Peru's  Voters  May  Turn  to  a  Tested,  and  Failed,  Leader 
 2006-05-03T00:00:00Z,glocations,Peru,357,0.0,Peru's  Looming  Disaster 
 2006-04-10T00:00:00Z,glocations,Peru,988,0.0,Nationalist  Ahead  in  Peru,  but  Faces  Runoff 
 2006-04-02T00:00:00Z,glocations,Peru,1329,0.0,Nationalism  and  Populism  Propel  Front-Runner  in  Peru 
 2012-06-11T00:00:00Z,glocations,NEWYORKMETROPOLITANAREA,5812,0.0,Relishing  a  Glut  of  Sports 
 2012-05-26T00:00:00Z,glocations,PERU,1347,0.0,Peru  Forced  To  Confront  Deep  Scars  Of  Civil  War 
 2006-10-01T00:00:00Z,glocations,NEWHAVEN(CONN),729,0.0,These  Stitches,  In  Time,  May  Save  Some  Lives 
 2005-11-13T00:00:00Z,glocations,NEWYORKCITY,2528,0.0,From  Grit  To  Gloss 
 2005-10-29T00:00:00Z,glocations,KENTUCKY,1010,0.0,Battle  of  Sexes,  With  Monkey  Wrenches 
 2005-08-01T00:00:00Z,glocations,YELLOWSTONENATIONALPARK,1202,0.0,Mother  Nature's  Blockbusters 
 2005-03-03T00:00:00Z,glocations,DESMOINES(IOWA),1221,0.0,Flower  Shows  Growing  Like  Weeds 
 2005-02-13T00:00:00Z,glocations,ASTURIAS(SPAIN),2159,0.0,In  Old  Asturias,  a  Legacy  From  the  New  World 
 2004-09-19T00:00:00Z,glocations,MAINE,2440,0.0,Through  Artists'  Eyes 
 2004-09-10T00:00:00Z,glocations,JAMAICA,1065,0.0,After  Devastating  Grenada,  Hurricane  Bears  Down  on  Jamaica 
 2004-06-27T00:00:00Z,glocations,GERMANY,953,0.0,Peru  Photo  Exhibit  Captures  Pathos  of  20  Years  of  War 
 2003-11-02T00:00:00Z,glocations,GREENLAND,2185,0.0,It's  Not  Easy  in  Greenland,  But  It's  Definitely  Cool 
 2003-10-10T00:00:00Z,glocations,MADISON(WIS),1348,0.0,36  Hours  |  Madison,  Wis. 
 2003-10-05T00:00:00Z,glocations,NEWYORKCITY,2741,0.0,Palimpsest  Street 
 2003-09-28T00:00:00Z,glocations,HAMPTONS,THE(NY),2190,0.0,In  Island's  Wealthiest  Area,  Backlash  Against  the  Poorest 
 2003-08-31T00:00:00Z,glocations,PERU,774,0.0,Truth  Commission  Leaves  Many  Indians  in  Peru  Unsatisfied 
 2003-06-29T00:00:00Z,glocations,PYRENEESMOUNTAINS,2105,0.0,'Chariots  of  Fire'  Trek  In  the  Pyrenees 
 2003-06-20T00:00:00Z,glocations,NEWYORKSTATE,1103,0.0,Day  Hikes  Around  the  Nation:  Convenient  and  Challenging 
 2003-06-18T00:00:00Z,glocations,PERU,88,0.0,World  Briefing  |  Americas:  Peru:  20-Year  Conflict  Claimed  60,000 
 2002-12-21T00:00:00Z,glocations,LUCCANAMERCA(PERU),0,0.0,To  a  Final  Resting  Place 
 2002-10-04T00:00:00Z,glocations,ASHEVILLE(NC),1590,0.0,36  Hours  |  Asheville,  N.C. 
 2002-09-20T00:00:00Z,glocations,BURLINGTON(VT),1429,0.0,36  Hours  |  Burlington,  Vt. 
 2002-06-13T00:00:00Z,glocations,SANFRANCISCO(CALIF),1632,0.0,The  Chroming  Of  the  Front  Yard 
 2002-04-28T00:00:00Z,glocations,NEWYORKCITY,2692,0.0,Pick  One 
 2002-04-24T00:00:00Z,glocations,NEPAL,1351,0.0,As  Maoist  Revolt  Grows,  Nepal  Fears  for  Its  Democracy 
 2002-03-24T00:00:00Z,glocations,ISRAEL,908,0.0,FRONT  LINES 
 2002-02-24T00:00:00Z,glocations,HALFDOME(CALIF),1384,0.0,The  Height  of  Folly 
 2002-02-14T00:00:00Z,glocations,COLOMBIA,1250,0.0,Farmers  in  Peru  Are  Turning  Again  to  Coca  Crop 
 2002-01-20T00:00:00Z,glocations,NEWYORKCITY,892,0.0,Museum  Honors  Those  Who  Only  Winch  and  Tow 
 2002-01-13T00:00:00Z,glocations,NEWYORKCITY,1899,0.0,In  the  Pit,  Dark  Relics  and  Last  Obstacles 
 2001-12-05T00:00:00Z,glocations,PERU,71,0.0,World  Briefing  |  Americas:  Peru:  Maoist  Group  Suspected  In  Bombing 
 2001-11-28T00:00:00Z,glocations,NEWYORKCITY,706,0.0,Liberties;  Hunks  And  Brutes 
 2001-09-18T00:00:00Z,glocations,NEWYORKCITY,776,0.0,The  Big  City;  Fantasies  Of  Vengeance,  Fed  by  Fury 
 2001-08-05T00:00:00Z,glocations,SLOVENIA,2344,0.0,A  Distant  Corner  of  Europe 
 2001-07-01T00:00:00Z,glocations,HAITI,3563,0.0,The  Poor  Man's  Capitalist 
 2001-03-04T00:00:00Z,glocations,KAUAI(HAWAII),2425,0.0,Seeing  Kauai  By  Kayak 
 2001-01-07T00:00:00Z,glocations,PERU,446,0.0,For  travelers  in  Peru,  a  few  words  about  safety  .  .  . 
 2001-01-07T00:00:00Z,glocations,PERU,2258,0.0,GOOD  MORNING  IN  PERU'S  'LOST  CITY' 
 2001-01-07T00:00:00Z,glocations,AYACUCHOPROVINCE(PERU),2384,0.0,BREATHLESS  IN  A  COLONIAL  PERCH 
 2000-11-19T00:00:00Z,glocations,BUENAVISTA(MEXICO),3229,0.0,Baja;  Finding  Solitude  and  Big  Fish  in  Baja  California 
 2000-11-12T00:00:00Z,glocations,ITALY,2277,0.0,La  Dolce  Vita  in  the  Dolomites 
 2000-09-24T00:00:00Z,glocations,CHINA,1197,0.0,China's  Opportunities,  And  Ours 
 2000-09-15T00:00:00Z,glocations,NEWYORKCITY,309,0.0,DINER'S  JOURNAL 
 2000-09-13T00:00:00Z,glocations,ISRAEL,1411,0.0,'A'  Is  for  Arafat,  'B'  Is  for  Bethlehem 
 2000-06-04T00:00:00Z,glocations,LATINAMERICA,984,0.0,The  World;  Autocrat?  Democrat?  Well,  Both. 
 2000-05-21T00:00:00Z,glocations,GREATBRITAIN,2200,0.0,In  the  Foothills  Of  the  Malverns 
 1999-12-19T00:00:00Z,glocations,NEWJERSEY,2831,0.0,Finding  Themselves,  And  Their  Niche,  In  the  Marketplace 
 1999-10-22T00:00:00Z,glocations,NEWYORKCITY,1645,0.0,A  Sunday  in  the  Park  With  Others  From  Everywhere 
 1999-09-07T00:00:00Z,glocations,AYACUCHOPROVINCE(PERU),793,0.0,Vicus  Journal;  Children  at  Play  Exorcise  a  Brutal  War's  Demons 
 1999-08-29T00:00:00Z,glocations,PERU,1531,0.0,A  Revolution  Peru's  Rebels  Didn't  Intend 
 1999-08-22T00:00:00Z,glocations,VANCOUVER(BRITISHCOLUMBIA),2676,0.0,Vancouver's  Lush  Landscapes 
 1999-07-11T00:00:00Z,glocations,BIGHOLERIVER(MONT),2716,0.0,Where  the  Trout  Jump  Onto  the  Hook 
 1999-05-23T00:00:00Z,glocations,NEWYORKCITY,3155,0.0,Living  Aboard 
 1999-01-17T00:00:00Z,glocations,FLORIDA,1687,0.0,Escape  From  Aqueduct 
 1998-11-22T00:00:00Z,glocations,JAPAN,2857,0.0,Japan  Rail  Helps  A  Pilgrim's  Progress 
 1998-10-04T00:00:00Z,glocations,AZERBAIJAN,7657,0.0,The  Crude  Face  of  Global  Capitalism 
 1998-09-14T00:00:00Z,glocations,YOSEMITENATIONALPARK,1198,0.0,Locking  Up  the  Toothpaste,  Staring  at  the  Sublime 
 1998-09-06T00:00:00Z,glocations,BOUNDARYWATERSCANOEAREAWILDERNESS(MINNESOTA),2814,0.0,In  Minnesota,  Due  North 
 1998-08-16T00:00:00Z,glocations,ISTANBUL(TURKEY),2809,0.0,A  Whirl  Through  Istanbul 
 1998-08-09T00:00:00Z,glocations,CANADA,1917,0.0,In  the  Realm  of  Bears 
 1998-03-22T00:00:00Z,glocations,PUGETSOUND(WASHINGTON),2162,0.0,Green  Enough  for  Envy 
 1998-03-01T00:00:00Z,glocations,GREECE,2789,0.0,Adventure;  Climbing  to  the  Gods 
 1997-12-07T00:00:00Z,glocations,RUSSIA,2741,0.0,Will  Moscow's  Gain  Be  a  Loss  For  Investors? 
 1997-10-09T00:00:00Z,glocations,NORTHERNIRELAND,683,0.0,U.S.  Labels  30  Groups  As  Terrorists;  Omits  I.R.A. 
 1997-09-29T00:00:00Z,glocations,PERU,201,0.0,World  News  Briefs;  Mass  Grave  Uncovered  In  Peru  Rebels'  Area 
 1997-08-22T00:00:00Z,glocations,NEWYORKCITY,3418,0.0,Where  to  Cool  Both  Soul  and  Heels 
 1997-06-29T00:00:00Z,glocations,UPPERPENINSULA(MICHIGAN),2719,0.0,Clip-Clopping  to  the  19th  Century 
 1997-05-11T00:00:00Z,glocations,SCOTLAND,3081,0.0,Memoirs  of  an  Orkneys  Addict 
 1997-04-27T00:00:00Z,glocations,PERU,897,0.0,Peru's  Old  Problem 
 1997-04-27T00:00:00Z,glocations,LIMA(PERU),873,0.0,In  Peru,  a  Brilliant  Rescue  Shines  No  Light  on  Terror 
 1997-04-23T00:00:00Z,glocations,JAPAN,813,0.0,For  Revolutionary  Group,  an  All-Out  Offensive  Turns  Into  Disastrous  Defeat 
 1997-01-12T00:00:00Z,glocations,JAPAN,975,0.0,Talks  Resume  Between  Peru  And  Guerrillas 
 1997-01-10T00:00:00Z,glocations,NEWYORKCITY,3078,0.0,In  the  Village,  50-Year  Affair  For  a  Walker  Still  in  Love 
 1997-01-07T00:00:00Z,glocations,JAPAN,852,0.0,Peru  Turns  A  Deaf  Ear  To  Rebels 
 1997-01-05T00:00:00Z,glocations,SARASOTA(FLA),2434,0.0,Making  Time  Fly  in  Preseason  Sarasota 
 1997-01-05T00:00:00Z,glocations,JAPAN,1010,0.0,Hostage  Crisis  Imperils  the  Growth  of  Peru's  Economy 
 1996-12-29T00:00:00Z,glocations,JAPAN,153,0.0,Japan  Yielded  to  Rebels  in  '86,  Report  Says 
 1996-12-29T00:00:00Z,glocations,JAPAN,951,0.0,Revolution  as  a  Relic  Come  to  Life 
 1996-12-25T00:00:00Z,glocations,JAPAN,917,0.0,In  a  Lima  Slum,  No  Support  for  Hostage  Takers 
 1996-12-19T00:00:00Z,glocations,JAPAN,580,0.0,The  Rebels  and  the  Cause:  12  Years  of  Peru's  Turmoil 
 1996-10-27T00:00:00Z,glocations,PUERTORICO,2466,0.0,Puerto  Rico,  Beyond  The  Mountains 
 1996-08-05T00:00:00Z,glocations,PERU,842,0.0,Blasts  Propel  Peru's  Rebels  From  Defunct  To  Dangerous 
 1996-06-15T00:00:00Z,glocations,CHICAGO(ILL),1369,0.0,DNA  Tests  and  a  Confession  Set  Three  on  the  Path  to  Freedom  in  1978Murders 
 1996-01-11T00:00:00Z,glocations,NEWYORKCITY,1021,0.0,After  Blanket  of  Snow,  the  Fading  Quietude  of  a  Different  City 
 1995-12-22T00:00:00Z,glocations,PERU,952,0.0,Embattled  Guerrilla  Group  in  Peru  Shifts  Tactics  Against  Government 
 1995-05-21T00:00:00Z,glocations,NEWYORKCITY,2095,0.0,A  Flare  For  Fantasy:  'Miami  Vice'  Meets  42d  Street 
 1995-03-28T00:00:00Z,glocations,NEWYORKCITY,829,0.0,Beggars  Can't  Be  Choosy,  So  They  Choose  PATH 
 1995-03-27T00:00:00Z,glocations,COLOMBIA,884,0.0,U.S.  Copters  Are  a  Target  in  Colombia 
 1995-03-26T00:00:00Z,glocations,PERU,1484,0.0,Getting  Over  the  Andes  And  Traveler's  Guilt 
 1995-03-20T00:00:00Z,glocations,LIMA(PERU),1056,0.0,Shining  Path  Rebels  Step  Up  Terror  Campaign  in  Peru 
 1995-02-06T00:00:00Z,glocations,ECUADOR,548,0.0,Peru  and  Ecuador  Wage  Guerrilla  War  as  Talks  Break  Off 
 1995-01-31T00:00:00Z,glocations,ECUADOR,788,0.0,Thousands  of  Peruvians  Flee  Border  Fighting 
 1995-01-29T00:00:00Z,glocations,AMAZONRIVERBASIN,574,0.0,Ecuador  and  Peru  Again  Skirmish  Over  an  Old  Disputed  Border 
 1995-01-08T00:00:00Z,glocations,MACHUPICCHU(PERU),630,0.0,Despite  Safety  Concerns,  Tourism  to  Peru  Surges 
 1994-12-14T00:00:00Z,glocations,AYACUCHO(PERU),867,0.0,Ayacucho  Journal;  Shining  Path  Is  Shackled,  and  Joy  Is  Unconfined 
 1994-12-11T00:00:00Z,glocations,NEWYORKCITY,1310,0.0,Habitats/272  Alexander  Avenue;  Bronx  Homesteading:  It's  Grueling,  but  Rewarding 
 1994-11-06T00:00:00Z,glocations,HAITI,3584,0.0,'I  Never  Seen  Nothing  Like  That' 
 1994-09-30T00:00:00Z,glocations,CAJAMARQUILLA(PERU),847,0.0,Cajamarquilla  Journal;  A  Question  of  Priority:  Archeology  vs.  Refugees 
 1994-04-08T00:00:00Z,glocations,VENEZUELA,1382,0.0,The  New  South  Americans:  Friends  and  Partners 
 1994-03-06T00:00:00Z,glocations,DENMARK,2726,0.0,Where  Herring  is  Art 
 1994-02-22T00:00:00Z,glocations,PERU,512,0.0,9  Peruvian  Military  Men  Are  Sentenced  in  Killings 
 1994-01-07T00:00:00Z,glocations,PERU,642,0.0,Toll  in  Peru's  War  With  Rebels  Is  Down  by  Half 
 1993-12-08T00:00:00Z,glocations,RIMAC(PERU),828,0.0,Rimac  Journal;  In  a  Calmer  Peru,  Braver  Bulls  and  Fewer  Bombs 
 1993-09-19T00:00:00Z,glocations,UNITEDSTATES,4867,0.0,The  United  States  of  Asylum 
 1993-08-22T00:00:00Z,glocations,BRAZIL,183,0.0,August  15-21;  For  Gold  or  Politics:  Miners  Slaughter  Indians  In  Brazil,  and  Guerrillas  Attack  Them  in  Peru 
 1993-08-20T00:00:00Z,glocations,VASILYEVO(RUSSIA),1358,0.0,The  Smiles  of  a  Summer  Day  at  the  Volga  Dachas 
 1993-08-06T00:00:00Z,glocations,PERU,666,0.0,Peru  Is  Expected  to  Extend  Death  Penalty  to  Terrorists 
 1993-07-28T00:00:00Z,glocations,PERU,850,0.0,4  Wounded  as  Rebels  Bomb  U.S.  Embassy  in  Peru 
 1993-06-25T00:00:00Z,glocations,CHILE,905,0.0,San  Pedro  de  Tiquina  Journal;  Landlocked  Navy's  Dream  Is  to  Go  Down  to  Sea 
 1993-05-29T00:00:00Z,glocations,EGYPT,1211,0.0,Once  Off-Limits,  Now  Destinations  With  an  Edge 
 1993-05-09T00:00:00Z,glocations,CAMBODIA,856,0.0,Chinese  Support  for  Khmer  Rouge  Grows  Cooler 
 1993-04-26T00:00:00Z,glocations,PERU,798,0.0,Army  Deploys  Tanks  in  Peru  in  Challenge  to  New  Congress 
 1993-04-02T00:00:00Z,glocations,FAREAST,SOUTHANDSOUTHEASTASIAANDPACIFICAREAS,380,0.0,Coca  Output  Stayed  Level  in  '92  For  the  3d  Year,  State  Dept.  Says 
 1993-02-26T00:00:00Z,glocations,GILARIVER,1021,0.0,Arizona  Braces  to  Meet  Once-in-200-Years  Flood 
 1993-02-14T00:00:00Z,glocations,LATINAMERICA,389,0.0,Latin  Conflicts  Rooted  in  Complexities 
 1993-01-29T00:00:00Z,glocations,LAMOLINA(PERU),322,0.0,Rebels  Continue  Bombings  In  Effort  to  Halt  Peru's  Vote 
 1992-12-31T00:00:00Z,glocations,CHINA,1363,0.0,Peruvian  State  Iron  Company  Finds  a  'Private'  Buyer:  China 
 1992-11-23T00:00:00Z,glocations,PERU,674,0.0,Fujimori  Winning  Both  Peruvian  Votes,  Counts  Show 
 1992-11-09T00:00:00Z,glocations,PERU,336,0.0,Peruvians  Refuse  to  Give  Up  Hope 
 1992-10-11T00:00:00Z,glocations,LATINAMERICA,2133,0.0,Squalid  Slums  Grow  as  People  Flood  Latin  America's  Cities 
 1992-10-11T00:00:00Z,glocations,RUSSIA,2402,0.0,Journey  Into  the  Heart  of  Russia 
 1992-10-09T00:00:00Z,glocations,PERU,0,0.0,Peru's  Security  Forces  on  Alert  after  Rebels'  Sentencing 
 1992-09-27T00:00:00Z,glocations,PERU,666,0.0,Peru's  Invisible  Judges:  a  Faceless  Tyranny? 
 1992-09-20T00:00:00Z,glocations,UNITEDSTATES,1106,0.0,U.S.  Anti-Drug  Moves  Irk  Bolivians 
 1992-09-05T00:00:00Z,glocations,BOLIVIA,1358,0.0,BOLIVIANS  IN  FEAR  AS  MAOIST  REBELS  SLIP  IN  FROM  PERU 
 1992-08-30T00:00:00Z,glocations,PERU,628,0.0,Shining  Path  Rebels  Infiltrate  Peru's  Schools 
 1992-07-26T00:00:00Z,glocations,PERU,841,0.0,Peruvian  Strike  Called  a  Big  Victory  for  Shining  Path 
 1992-07-26T00:00:00Z,glocations,PERU,179,0.0,July  19-25:  40  Killed;  Shining  Path  Guerrillas  Shut  Down  Much  of  Lima 
 1992-07-24T00:00:00Z,glocations,SOUTHAMERICA,1262,0.0,Kidnapping  and  'Taxes'  Transform  Guerrilla  Inc. 
 1992-07-18T00:00:00Z,glocations,NEWYORKCITY,683,0.0,Delegates  Leave  Behind  A  Satisfied  New  York  City 
 1992-06-28T00:00:00Z,glocations,NEWYORKCITY,2356,0.0,Sixth-Grade  Graduation  Ceremony:  Moment  for  Pride  on  Treacherous  Path 
 1992-06-22T00:00:00Z,glocations,PERU,273,0.0,Peru's  Indians  Look  to  Shining  Path  to  Speak  of  Their  Pain 
 1992-06-10T00:00:00Z,glocations,NEWJERSEY,981,0.0,Trenton  Crime  Bill:  Puzzling  Package  Stirs  Concern  Over  Assault  Weapons 
 1992-05-31T00:00:00Z,glocations,GREATBRITAIN,1542,0.0,The  Surprises  Of  a  Stay  In  a  Stately  Flat 
 1992-05-30T00:00:00Z,glocations,LATINAMERICA,3255,0.0,After  the  Cold  War:  Views  From  Latin  America;  Sweeping  Political  Changes  Leave  Latin  Poor  Still  Poor 
 1992-05-26T00:00:00Z,glocations,INGENIO(PERU),932,0.0,Ingenio  Journal;  Roadblock  on  the  Shining  Path:  Angry  Peasants 
 1992-05-10T00:00:00Z,glocations,LIMA(PERU),361,0.0,Rebel  Inmates  Surrender  in  Peru 
 1992-04-25T00:00:00Z,glocations,PERU,948,0.0,U.S.  Says  a  C-130  Was  Hit  by  Gunfire  From  Peru 
 1992-04-23T00:00:00Z,glocations,NEWYORKCITY,940,0.0,New  Cabbies  Reflect  Change  In  the  Mosaic  Of  New  York 
 1992-04-12T00:00:00Z,glocations,PERU,926,0.0,Peru's  Basic  Problems  Won't  Be  Ordered  Away 
 1992-04-08T00:00:00Z,glocations,UPPERHUALLAGAVALLEY(PERU),1220,0.0,Peru's  Maoist  Drug  Dealers 
 1992-04-07T00:00:00Z,glocations,UNITEDSTATES,1192,0.0,Corruption  and  Cocaine  in  Peru 
 1992-04-07T00:00:00Z,glocations,PERU,2150,0.0,A  Lethal  Army  of  Insurgents  Lima  Could  Not  Stamp  Out 
 1992-03-29T00:00:00Z,glocations,BARCELONA(SPAIN),2850,0.0,A  New  Barcelona  From  the  Old 
 1992-03-28T00:00:00Z,glocations,COLOMBIA,899,0.0,Yurimaguas  Journal;  Fighting  the  Drug  War  In  the  Skies  Over  Peru 
 1992-03-24T00:00:00Z,glocations,LATINAMERICA,353,0.0,A  Military  Force  for  the  Americas 
 1992-03-22T00:00:00Z,glocations,PERU,874,0.0,In  Peru's  Shining  Path,  U.S.  Sees  Road  to  Ruin 
 1992-02-15T00:00:00Z,glocations,PERU,0,0.0,4  Police  Officers  Killed  in  Guerrilla  Attack  in  Peru 
 1992-01-24T00:00:00Z,glocations,PERU,113,0.0,Peruvian  Rebels  Assert  Role  In  Downing  of  a  U.S.  Copter 
 1992-01-23T00:00:00Z,glocations,EUROPE,918,0.0,Arica  Journal;  Cocaine  Invades  Chile,  Scorning  the  Land  Mines 
 1991-12-22T00:00:00Z,glocations,UPPERHUALLAGAVALLEY(PERU),657,0.0,The  Cocaine  War's  Biggest  Success:  a  Fungus 
 1991-12-18T00:00:00Z,glocations,PERU,607,0.0,Shining  Path  Supporters  Abroad  Anger  Peru 
 1991-12-16T00:00:00Z,glocations,PERU,1522,0.0,Terrorism  Strains  Peru's  Reforms 
 1991-12-15T00:00:00Z,glocations,PERU,668,0.0,Peru's  Most  Desperate  Refugees  Cross  No  Borders 
 1991-12-13T00:00:00Z,glocations,NEWYORKCITYMETROPOLITANAREA,2747,0.0,The  Mammoth  Multiplexes  of  the  Suburbs:  How  They  Rate 
 1991-12-10T00:00:00Z,glocations,PERU,621,0.0,Peru's  Rebels  Driving  Church  Underground 
 1991-11-05T00:00:00Z,glocations,PERU,360,0.0,GUERRILLAS  IN  PERU  KILL  16  IN  CAPITAL 
 1991-08-26T00:00:00Z,glocations,PERU,911,0.0,Youths  Trampled  in  Peru's  Gold  Rush 
 1991-08-19T00:00:00Z,glocations,PERU,326,0.0,Stop  Rewarding  Peru  for  Brutality 
 1991-08-11T00:00:00Z,glocations,PERU,977,0.0,The  Challenge  in  Peru:  Drugs  and  Disarray 
 1991-08-11T00:00:00Z,glocations,PERU,473,0.0,What  the  U.S.  Can  Do  in  Peru 
 1991-07-14T00:00:00Z,glocations,PERU,938,0.0,The  World;  10  Die  a  Day,  Or  Disappear,  And  Peru  Goes  Numb 
 1991-07-10T00:00:00Z,glocations,PERU,954,0.0,Lima  Journal;  Bars  Do  Not  a  Prison  Make,  but  What  of  Dogma? 
 1991-07-05T00:00:00Z,glocations,PERU,125,0.0,Peru  Blames  Guerrillas  For  at  Least  14  Deaths 
 1991-07-02T00:00:00Z,glocations,PERU,1246,0.0,Oil  Drilling  Weighed  In  Peru  Nature  Area 
 1991-06-19T00:00:00Z,glocations,PERU,179,0.0,Guerrillas  Raid  U.S.  Anti-Drug  Base  in  Peru 
 1991-06-17T00:00:00Z,glocations,HILLSIDE(NJ),1891,0.0,43  Police  Shots,  2  Deaths,  and  a  Big  'Why?' 
 1991-05-30T00:00:00Z,glocations,LIMA(PERU),170,0.0,Guerrillas  in  Peru  Dynamite  Power  Lines  and  Kill  Officer 
 1991-03-17T00:00:00Z,glocations,GREATBRITAIN,2695,0.0,A  Footpath  Along  the  Welsh  Border 
